id	doi	title	author	journaltitle	volume	issue	pubdate	pagerange	publisher	type	reviewed.work	abstractdata/JASAL3/1/AYRES	doi	Rosemary Dobson--The Text and The Textile	Mary-Louise AYRES	JASAL	SI	1	1994-01-01	57-63	publisher	type	reviewed_work	https://openjournals.library.sydney.edu.au/index.php/JASAL/article/view/9439data/JASAL3/2/BLABER	doi	'Apocalepsus':<U+00A0>The Year of the Angry Rabbitand Braddon's View of Australia	Ron BLABER	JASAL	SI	1	1994-01-01	127-132	publisher	type	reviewed_work	https://openjournals.library.sydney.edu.au/index.php/JASAL/article/view/9451data/JASAL3/3/BENNETT	doi	'Asian Australian' migrant Identity: Brian Castro's<U+00A0>Birds of Passage<U+00A0>and<U+00A0>After China	Cathy BENNETT	JASAL	SI	1	1994-01-01	145-152	publisher	type	reviewed_work	https://openjournals.library.sydney.edu.au/index.php/JASAL/article/view/9454data/JASAL3/4/CHADWICK	doi	'Sweet Relief': The Politics of Erotic Experience in the Poetry of Lesbia Harford, Mary Fullerton and Zora Cross	Kate CHADWICK	JASAL	SI	1	1994-01-01	71-78	publisher	type	reviewed_work	https://openjournals.library.sydney.edu.au/index.php/JASAL/article/view/9441data/JASAL3/5/CHARLWOOD	doi	The Transformation of Experience into Literary Form in My Writings about the War	Don CHARLWOOD	JASAL	SI	1	1994-01-01	113-115	publisher	type	reviewed_work	https://openjournals.library.sydney.edu.au/index.php/JASAL/article/view/9448data/JASAL3/6/CLANCY	doi	'City of Sighs': The Poetry of John Shaw Neilson	Laurie CLANCY	JASAL	SI	1	1994-01-01	48-56	publisher	type	reviewed_work	https://openjournals.library.sydney.edu.au/index.php/JASAL/article/view/9438data/JASAL3/7/COATES	doi	Guns 'n' Roses: Australian Women Writers' Bold-And-Not-So-Bold Journeys into the Great War	Donna COATES	JASAL	SI	1	1994-01-01	120-126	publisher	type	reviewed_work	https://openjournals.library.sydney.edu.au/index.php/JASAL/article/view/9450data/JASAL3/8/DOCKER	doi	White Mythologies: Ethnicity and Identity in White and Joyce -<U+00A0>Riders in the Chariot<U+00A0>andUlysses	John DOCKER	JASAL	SI	1	1994-01-01	207-211	publisher	type	reviewed_work	https://openjournals.library.sydney.edu.au/index.php/JASAL/article/view/9463data/JASAL3/9/FRANKLIN	doi	A Lost Novel by George Chamier	Carol FRANKLIN	JASAL	SI	1	1994-01-01	87-92	publisher	type	reviewed_work	https://openjournals.library.sydney.edu.au/index.php/JASAL/article/view/9443data/JASAL3/10/FREIMAN	doi	Journey as Genre: The Search for Home and History in Arnold Zable's<U+00A0>Jewels and Ashes	Marcelle FREIMAN	JASAL	SI	1	1994-01-01	153-158	publisher	type	reviewed_work	https://openjournals.library.sydney.edu.au/index.php/JASAL/article/view/9455data/JASAL3/11/GODDARD	doi	Contingency or Remedy? That Little Herb of Self-Heal	Kerry GODDARD	JASAL	SI	1	1994-01-01	28-34	publisher	type	reviewed_work	https://openjournals.library.sydney.edu.au/index.php/JASAL/article/view/9435data/JASAL3/12/GOULD	doi	A Gravitational Pull	Alan GOULD	JASAL	SI	1	1994-01-01	108-112	publisher	type	reviewed_work	https://openjournals.library.sydney.edu.au/index.php/JASAL/article/view/9447data/JASAL3/14/KEANE	doi	Newcomers, Postmodernism and Feminist Experiment	Colleen KEANE	JASAL	SI	1	1994-01-01	165-171	publisher	type	reviewed_work	https://openjournals.library.sydney.edu.au/index.php/JASAL/article/view/9457data/JASAL3/15/KILEY	doi	The Vernacular Country Club: Traditional experiment, experimental tradition and Les Murray's<U+00A0>The Boys Who Stole the Funeral	Dean KILEY	JASAL	SI	1	1994-01-01	64-70	publisher	type	reviewed_work	https://openjournals.library.sydney.edu.au/index.php/JASAL/article/view/9440data/JASAL3/16/KIRKPATRICK	doi	Slessor's Darlinghurst Nights: Troping the Light Fantastic	Peter KIRKPATRICK	JASAL	SI	1	1994-01-01	7,13	publisher	type	reviewed_work	https://openjournals.library.sydney.edu.au/index.php/JASAL/article/view/9432data/JASAL3/17/LEE	doi	Monumental Authority and Regional Identity: The Canonisation of George Essex Evans	Christoper LEE	JASAL	SI	1	1994-01-01	93-99	publisher	type	reviewed_work	https://openjournals.library.sydney.edu.au/index.php/JASAL/article/view/9444data/JASAL3/18/LITTLE	doi	Auntie Rita's Story	Janine LITTLE	JASAL	SI	1	1994-01-01	159-164	publisher	type	reviewed_work	https://openjournals.library.sydney.edu.au/index.php/JASAL/article/view/9456data/JASAL3/19/McDONNELL	doi	Losing the Plot: Modernism and the Schizophrenic Woman in<U+00A0>The Aunt's Story	Kate McDONNELL	JASAL	SI	1	1994-01-01	200-206	publisher	type	reviewed_work	https://openjournals.library.sydney.edu.au/index.php/JASAL/article/view/9462data/JASAL3/20/MILECH	doi	'A Novel I Believe In': Reading Elizabeth Jolley	Barbara MILECH	JASAL	SI	1	1994-01-01	187-195	publisher	type	reviewed_work	https://openjournals.library.sydney.edu.au/index.php/JASAL/article/view/9460data/JASAL3/21/MULLER	doi	Once More With Feeling - Sex and the Self-Discovery Narrative	Vivienne MULLER	JASAL	SI	1	1994-01-01	172-179	publisher	type	reviewed_work	https://openjournals.library.sydney.edu.au/index.php/JASAL/article/view/9458data/JASAL3/22/MUMME	doi	Barbara Hanrahan's Work of Autobiographical Fiction	George MUMME	JASAL	SI	1	1994-01-01	42-47	publisher	type	reviewed_work	https://openjournals.library.sydney.edu.au/index.php/JASAL/article/view/9437data/JASAL3/23/MURRAY	doi	Remaking Femininity and Desire: a Post-War Reconstruction Project	Pamela MURRAY	JASAL	SI	1	1994-01-01	133-138	publisher	type	reviewed_work	https://openjournals.library.sydney.edu.au/index.php/JASAL/article/view/9452data/JASAL3/24/ROSSITER	doi	Narratives of Emergence: Landscape photography in Late Nineteenth century Western Australia	Ned ROSSITER	JASAL	SI	1	1994-01-01	20-27	publisher	type	reviewed_work	https://openjournals.library.sydney.edu.au/index.php/JASAL/article/view/9434data/JASAL3/25/PAGE	doi	Should Non-combatants Write about War?	Geoff PAGE	JASAL	SI	1	1994-01-01	105-107	publisher	type	reviewed_work	https://openjournals.library.sydney.edu.au/index.php/JASAL/article/view/9446data/JASAL3/26/PIERCE	doi	Australian Chivalry: Australian Chivalry?	Peter PIERCE	JASAL	SI	1	1994-01-01	116-119	publisher	type	reviewed_work	https://openjournals.library.sydney.edu.au/index.php/JASAL/article/view/9449data/JASAL3/27/DALZIELL	doi	The Shaming of Australian Culture: Refracted Shame in Kathleen Fitzpatrick's<U+00A0>Solid Bluestone Foundations	Rosamund DALZIELL	JASAL	SI	1	1994-01-01	180-186	publisher	type	reviewed_work	https://openjournals.library.sydney.edu.au/index.php/JASAL/article/view/9459data/JASAL3/28/SHARKEY	doi	McKee Wright's 'O Rare Young Man: David McKee Wright's Bulletin debates with Jack Lindsay, 1922-25	Michael SHARKEY	JASAL	SI	1	1994-01-01	1,6	publisher	type	reviewed_work	https://openjournals.library.sydney.edu.au/index.php/JASAL/article/view/9431data/JASAL3/29/STANIER	doi	'It's all lies!': David Malouf's<U+00A0>Johnno<U+00A0>and Autobiography	Michael STANIER	JASAL	SI	1	1994-01-01	196-199	publisher	type	reviewed_work	https://openjournals.library.sydney.edu.au/index.php/JASAL/article/view/9461data/JASAL3/30/STUART	doi	Early Convict Novels	Lurline STUART	JASAL	SI	1	1994-01-01	100-104	publisher	type	reviewed_work	https://openjournals.library.sydney.edu.au/index.php/JASAL/article/view/9445data/JASAL3/31/SYAL	doi	Reading Australian Poetry in the Indian Classroom	Pushpinder SYAL	JASAL	SI	1	1994-01-01	139-144	publisher	type	reviewed_work	https://openjournals.library.sydney.edu.au/index.php/JASAL/article/view/9453data/JASAL3/32/THOMSON	doi	Dora's Antipodean Inheritors: psychiatric Therapy in<U+00A0>Poppy,<U+00A0>Julia Paradise, and<U+00A0>Still Murder,	Helen THOMSON	JASAL	SI	1	1994-01-01	79-86	publisher	type	reviewed_work	https://openjournals.library.sydney.edu.au/index.php/JASAL/article/view/9442data/JASAL3/33/THYER	doi	Representations of Public and Private Bodies in the Written and Visual Work of Barbara Hanrahan	Felicity THYER	JASAL	SI	1	1994-01-01	35-41	publisher	type	reviewed_work	https://openjournals.library.sydney.edu.au/index.php/JASAL/article/view/9436data/JASAL3/34/TYAS	doi	What can you do with a horizon?: Landscape in Recent Australian Fiction and the Visual Arts	Gillian TYAS	JASAL	SI	1	1994-01-01	14-19	publisher	type	reviewed_work	https://openjournals.library.sydney.edu.au/index.php/JASAL/article/view/9433data/JASAL3/35/JOHNSTON	doi	Australian Autobiography: the Politics of Making Postcolonial Space	Anna JOHNSTON	JASAL	SI	1	1995-01-01	130-135	publisher	type	reviewed_work	https://openjournals.library.sydney.edu.au/index.php/JASAL/article/view/9965data/JASAL3/36/AYRES	doi	Mabel Forrest and the Witch	Mary-Louise AYRES	JASAL	SI	1	1996-01-01	76-84	publisher	type	reviewed_work	https://openjournals.library.sydney.edu.au/index.php/JASAL/article/view/9473data/JASAL3/37/BARCAN	doi	Natural Histories: Gender, Race and Regional Consciousness on the Gold Coast	Ruth BARCAN	JASAL	SI	1	1995-01-01	46-51	publisher	type	reviewed_work	https://openjournals.library.sydney.edu.au/index.php/JASAL/article/view/9952data/JASAL3/38/BREWSTER	doi	Fictocriticism: Pedagogy and Practice	Anne BREWSTER	JASAL	SI	1	1995-01-01	89-92	publisher	type	reviewed_work	https://openjournals.library.sydney.edu.au/index.php/JASAL/article/view/9958data/JASAL3/39/CADZOW	doi	Footnoting: Landscape and Space in the Exploration Diary of Emily Caroline Creaghe	Allison CADZOW	JASAL	SI	1	1995-01-01	52-60	publisher	type	reviewed_work	https://openjournals.library.sydney.edu.au/index.php/JASAL/article/view/9953data/JASAL3/40/DIXON	doi	Unfamiliar Selves: Ion L. Idriess' Torres Strait Trilogy	Robert DIXON	JASAL	SI	1	1995-01-01	78-83	publisher	type	reviewed_work	https://openjournals.library.sydney.edu.au/index.php/JASAL/article/view/9956data/JASAL3/41/DYSON	doi	'Near the Heart of the Imperial ethic': THe Boarding School as Apparatus of Patriarchy and Imperialism in<U+00A0>The Getting of Wisdom	Mandy DYSON	JASAL	SI	1	1995-01-01	145-148	publisher	type	reviewed_work	https://openjournals.library.sydney.edu.au/index.php/JASAL/article/view/9967data/JASAL3/42/ELLIS	doi	Rewriting Feminism in Katharine Susannah Prichard's<U+00A0>Intimate Strangers	Cath ELLIS	JASAL	SI	1	1995-01-01	208-213	publisher	type	reviewed_work	https://openjournals.library.sydney.edu.au/index.php/JASAL/article/view/10232data/JASAL3/43/FERGIE	doi	Evanescent, Oscillating, Never Quite Settled Upon: The Outback as Cultural Mirage	Deane FERGIE	JASAL	SI	1	1995-01-01	19-24	publisher	type	reviewed_work	https://openjournals.library.sydney.edu.au/index.php/JASAL/article/view/9948data/JASAL3/44/GANGULY	doi	Nationalism in Dalit and Aboriginal Texts	Debjani GANGULY	JASAL	SI	1	1995-01-01	113-122	publisher	type	reviewed_work	https://openjournals.library.sydney.edu.au/index.php/JASAL/article/view/9963data/JASAL3/45/GILDING	doi	Space Exploration: Catherine Martin, Australia, the World, the Universe and Whatever	Kevin GILDING	JASAL	SI	1	1995-01-01	61-70	publisher	type	reviewed_work	https://openjournals.library.sydney.edu.au/index.php/JASAL/article/view/9954data/JASAL3/46/GOLDSWORTHY	doi	The Space of Spinsterhood: Letters to the Female Middle Class Emigration Society 1862-1882	GOLDSWORTHY	JASAL	SI	1	1995-01-01	123-129	publisher	type	reviewed_work	https://openjournals.library.sydney.edu.au/index.php/JASAL/article/view/9964data/JASAL3/48/HUNN	doi	'Basic Bullshit'; Lesbian Detective Fiction and the Australian Lesbian and Gay Press	Deborah HUNN	JASAL	SI	1	1995-01-01	182-187	publisher	type	reviewed_work	https://openjournals.library.sydney.edu.au/index.php/JASAL/article/view/10227data/JASAL3/49/INDYK	doi	The Place of Desire	Ivor INDYK	JASAL	SI	1	1995-01-01	71-77	publisher	type	reviewed_work	https://openjournals.library.sydney.edu.au/index.php/JASAL/article/view/9955data/JASAL3/50/JOHNSTON	doi	'One Woman's Testimony': Louisa Anne Meredith's<U+00A0>Notes and Sketches of New South Wales	Judith JOHNSTON	JASAL	SI	1	1995-01-01	40-45	publisher	type	reviewed_work	https://openjournals.library.sydney.edu.au/index.php/JASAL/article/view/9951data/JASAL3/51/KERR	doi	Fictocriticism, the 'Doubtful Category' and 'The Space Between'	Heather KERR	JASAL	SI	1	1995-01-01	93-96	publisher	type	reviewed_work	https://openjournals.library.sydney.edu.au/index.php/JASAL/article/view/9959data/JASAL3/52/LUCAS	doi	Tracking the Body: Dorothy Porter's<U+00A0>Monkey's Mask	Rose LUCAS	JASAL	SI	1	1995-01-01	202-207	publisher	type	reviewed_work	https://openjournals.library.sydney.edu.au/index.php/JASAL/article/view/10231data/JASAL3/53/MacKENZIE	doi	Christina Stead and the 'Natural Uncanny'	Manifred MacKENZIE	JASAL	SI	1	1995-01-01	154-158	publisher	type	reviewed_work	https://openjournals.library.sydney.edu.au/index.php/JASAL/article/view/9969data/JASAL3/54/MARTIN	doi	Gender, Genera, Genre and Geography: Colonial Women's Writing and the Uses of Botany	Susan K. MARTIN	JASAL	SI	1	1995-01-01	30-39	publisher	type	reviewed_work	https://openjournals.library.sydney.edu.au/index.php/JASAL/article/view/9950data/JASAL3/55/McCREDDEN	doi	Mapping Religious Belief in Australian Culture	Lyn McCREDDEN	JASAL	SI	1	1995-01-01	102-107	publisher	type	reviewed_work	https://openjournals.library.sydney.edu.au/index.php/JASAL/article/view/9961data/JASAL3/56/McDONNELL	doi	House Arrest: Domestic Space in Christina Stead's Fiction	Jennifer McDONNELL	JASAL	SI	1	1995-01-01	136-144	publisher	type	reviewed_work	https://openjournals.library.sydney.edu.au/index.php/JASAL/article/view/9966data/JASAL3/57/McLEAN	doi	Imagining 'Australia': Paul Carter's Migrantology	Ian McLEAN	JASAL	SI	1	1995-01-01	25-29	publisher	type	reviewed_work	https://openjournals.library.sydney.edu.au/index.php/JASAL/article/view/9949data/JASAL3/58/MERLI & SALZMAN	doi	Imprinting/Erasing Woman	Carol MERIL and Paul SALZMAN	JASAL	SI	1	1995-01-01	175-181	publisher	type	reviewed_work	https://openjournals.library.sydney.edu.au/index.php/JASAL/article/view/9973data/JASAL3/59/CARTER	doi	Keynote Address: Crossing the Lines: Space as Colonialism	Paul CARTER	JASAL	SI	1	1995-01-01	1,12	publisher	type	reviewed_work	https://openjournals.library.sydney.edu.au/index.php/JASAL/article/view/9946data/JASAL3/60/PRATT	doi	Playing with Dolls: Masculinity and Desire in<U+00A0>Summer of the Seventeenth Doll	Catherine PRATT	JASAL	SI	1	1995-01-01	84-88	publisher	type	reviewed_work	https://openjournals.library.sydney.edu.au/index.php/JASAL/article/view/9957data/JASAL3/61/ROBB	doi	Academic Divination is not a Mysticism: Fictocriticism, Pedagogy and Hypertext	Simon ROBB	JASAL	SI	1	1995-01-01	97-101	publisher	type	reviewed_work	https://openjournals.library.sydney.edu.au/index.php/JASAL/article/view/9960data/JASAL3/62/RYAN	doi	Cartographic Eyes: Maps and Ideology	Simon RYAN	JASAL	SI	1	1995-01-01	13-18	publisher	type	reviewed_work	https://openjournals.library.sydney.edu.au/index.php/JASAL/article/view/9947data/JASAL3/63/SALTER	doi	Colonisation/Globalisation: an Argument in Support of Regional Literature	John SALTER	JASAL	SI	1	1995-01-01	197-201	publisher	type	reviewed_work	https://openjournals.library.sydney.edu.au/index.php/JASAL/article/view/10229data/JASAL3/64/TASKER	doi	Francis Adams: The Dilemma of the Radical Intellectual	Meg TASKER	JASAL	SI	1	1995-01-01	149-153	publisher	type	reviewed_work	https://openjournals.library.sydney.edu.au/index.php/JASAL/article/view/9968data/JASAL3/65/TORNEY	doi	Filling<U+00A0>Terra Nullius: Bony in the Deathspace	Kay TORNEY	JASAL	SI	1	1995-01-01	108-112	publisher	type	reviewed_work	https://openjournals.library.sydney.edu.au/index.php/JASAL/article/view/9962data/JASAL3/66/TURCOTTE	doi	Mrs Fraser's Ravenous Appetite: The Taste for Cannibalism in Captivitiy Narratives	Gerry TURCOTTE	JASAL	SI	1	1995-01-01	165-174	publisher	type	reviewed_work	https://openjournals.library.sydney.edu.au/index.php/JASAL/article/view/9972data/JASAL3/67/VAN den BERG	doi	Rewriting the Mainstream	Rosemary VAN den BERG	JASAL	SI	1	1995-01-01	159-161	publisher	type	reviewed_work	https://openjournals.library.sydney.edu.au/index.php/JASAL/article/view/9970data/JASAL3/68/WALWICZ	doi	Look at Me, Ma--I'm Going to Be a Marginal Writer!	Ania WALWICZ	JASAL	SI	1	1995-01-01	162-164	publisher	type	reviewed_work	https://openjournals.library.sydney.edu.au/index.php/JASAL/article/view/9971data/JASAL3/69/WARK	doi	Virtual Geography: Living with Global Media Events	McKenzie WARK	JASAL	SI	1	1995-01-01	188-196	publisher	type	reviewed_work	https://openjournals.library.sydney.edu.au/index.php/JASAL/article/view/10228data/JASAL3/70/BARKER	doi	The Milk of Mother's Kindness in Brian Castro'sDrift	Karen BARKER	JASAL	SI	1	1996-01-01	228-235	publisher	type	reviewed_work	https://openjournals.library.sydney.edu.au/index.php/JASAL/article/view/9492data/JASAL3/71/BARTLETT	doi	A Rose Is A...:Maternal Debt in Ania Walwicz's<U+00A0>Red Roses	Alison BARTLETT	JASAL	SI	1	1996-01-01	189-195	publisher	type	reviewed_work	https://openjournals.library.sydney.edu.au/index.php/JASAL/article/view/9487data/JASAL3/72/BUFFI	doi	Colour and Line to Word: The Writing of Janine Burke	Roberta BUFFI	JASAL	SI	1	1996-01-01	196-203	publisher	type	reviewed_work	https://openjournals.library.sydney.edu.au/index.php/JASAL/article/view/9488data/JASAL3/73/DE LA VALL	doi	Babylon or Jerusalem?: An Inversion of terms	Elisa Morera DE LA VALL	JASAL	SI	1	1996-01-01	137-143	publisher	type	reviewed_work	https://openjournals.library.sydney.edu.au/index.php/JASAL/article/view/9480data/JASAL3/74/DURING	doi	Literary Subjectivity	Simon DURING	JASAL	SI	1	1996-01-01	1,12	publisher	type	reviewed_work	https://openjournals.library.sydney.edu.au/index.php/JASAL/article/view/9465data/JASAL3/75/GAFFNEY	doi	The Fruit-Tree and the Veranda	Carmel GAFFNEY	JASAL	SI	1	1996-01-01	85-94	publisher	type	reviewed_work	https://openjournals.library.sydney.edu.au/index.php/JASAL/article/view/9474data/JASAL3/76/GELDER & JACOBS	doi	The Postcolonial Ghost Story	Ken GELDER and Jane M. JACOBS	JASAL	SI	1	1996-01-01	110-120	publisher	type	reviewed_work	https://openjournals.library.sydney.edu.au/index.php/JASAL/article/view/9477data/JASAL3/77/HENDERSON	doi	Collision Courses: Feminism, Postmodernism andThe Monkey's Mask	Margaret HENDERSON	JASAL	SI	1	1996-01-01	180-188	publisher	type	reviewed_work	https://openjournals.library.sydney.edu.au/index.php/JASAL/article/view/9486data/JASAL3/78/HOGAN	doi	'A Mob of Bloody Women'--Utopia,Collectivity and Multiplicity in Some Recent Fiction by Australian Women	Eleanor HOGAN	JASAL	SI	1	1996-01-01	236-251	publisher	type	reviewed_work	https://openjournals.library.sydney.edu.au/index.php/JASAL/article/view/9493data/JASAL3/79/KALNINS	doi	Good Writing: The Ethics and Aesthetics of Fiction	Patricia KALNINS	JASAL	SI	1	1996-01-01	172-179	publisher	type	reviewed_work	https://openjournals.library.sydney.edu.au/index.php/JASAL/article/view/9485data/JASAL3/80/KELLY	doi	In Search of the Colonial 'Australian' Playwright	Veronica KELLY	JASAL	SI	1	1996-01-01	262-269	publisher	type	reviewed_work	https://openjournals.library.sydney.edu.au/index.php/JASAL/article/view/9496data/JASAL3/81/KHOO	doi	Someone Else's Zoo: Asian Australian Women's Writing	Tseen Ling KHOO	JASAL	SI	1	1996-01-01	23-29	publisher	type	reviewed_work	https://openjournals.library.sydney.edu.au/index.php/JASAL/article/view/9467data/JASAL3/82/KIRKPATRICK	doi	Rethinking Poetry and the Popular or How to Resuscitate and Immoral Piece of Poultry	Peter KIRKPATRICK	JASAL	SI	1	1996-01-01	95-102	publisher	type	reviewed_work	https://openjournals.library.sydney.edu.au/index.php/JASAL/article/view/9475data/JASAL3/83/LEVER	doi	Postmodernism, History and Satire: David Foster and Salman Rushdie	Susan LEVER	JASAL	SI	1	1996-01-01	214-220	publisher	type	reviewed_work	https://openjournals.library.sydney.edu.au/index.php/JASAL/article/view/9490data/JASAL3/84/LOVELL	doi	The Search for Agency in the Fiction of Janette Turner Hospital	Sue LOVELL	JASAL	SI	1	1996-01-01	204-213	publisher	type	reviewed_work	https://openjournals.library.sydney.edu.au/index.php/JASAL/article/view/9489data/JASAL3/85/McCOOEY	doi	My Life as a Joke: Comic Australian Autobiography	David McCOOEY	JASAL	SI	1	1996-01-01	57-63	publisher	type	reviewed_work	https://openjournals.library.sydney.edu.au/index.php/JASAL/article/view/9471data/JASAL3/86/MESHER	doi	King Kong and Kung Fu: Asian and American Images in Georgia Savage's Gold Coast Novels	David MESHER	JASAL	SI	1	1996-01-01	13-22	publisher	type	reviewed_work	https://openjournals.library.sydney.edu.au/index.php/JASAL/article/view/9466data/JASAL3/87/MIELS	doi	'Gold Out of Straw': An Introduction to the Life and Work of Amy Witting	Yvonne MIELS	JASAL	SI	1	1996-01-01	39-49	publisher	type	reviewed_work	https://openjournals.library.sydney.edu.au/index.php/JASAL/article/view/9469data/JASAL3/88/MOORE	doi	'Threatened People Don't Breed': The Maternal Strike in Australian Women's Writing 1920s to 1950	Nicole MOORE	JASAL	SI	1	1996-01-01	252-261	publisher	type	reviewed_work	https://openjournals.library.sydney.edu.au/index.php/JASAL/article/view/9495data/JASAL3/90/RATCLIFFE	doi	An Un-Becoming Paradise: The Yandilli Trilogy	Greg RATCLIFFE	JASAL	SI	1	1996-01-01	164-171	publisher	type	reviewed_work	https://openjournals.library.sydney.edu.au/index.php/JASAL/article/view/9484data/JASAL3/91/RICHARDS	doi	Liars<U+00A0>vs<U+00A0>The New Diversity: Is there an Alternative to 'Postmodernist' Literary Studies?	Cameron RICHARDS	JASAL	SI	1	1996-01-01	30-38	publisher	type	reviewed_work	https://openjournals.library.sydney.edu.au/index.php/JASAL/article/view/9468data/JASAL3/92/ROONEY	doi	She Casts Herself as Revolutionary: Performance and Performativity in<U+00A0>The Man Who Loved Children	Brigid ROONEY	JASAL	SI	1	1996-01-01	129-136	publisher	type	reviewed_work	https://openjournals.library.sydney.edu.au/index.php/JASAL/article/view/9479data/JASAL3/93/DALZIELL	doi	Telling Shameful Stories: Autobiography as Testimony	Rosamund DALZIELL	JASAL	SI	1	1996-01-01	64-75	publisher	type	reviewed_work	https://openjournals.library.sydney.edu.au/index.php/JASAL/article/view/9472data/JASAL3/94/ROSS	doi	bony as Grotesque: The Dilemma of National Identity in Arthur Upfield's Bony Series, 1930-1950	Glen ROSS	JASAL	SI	1	1996-01-01	152-158	publisher	type	reviewed_work	https://openjournals.library.sydney.edu.au/index.php/JASAL/article/view/9482data/JASAL3/95/SAREEN	doi	The Aboriginal Fiction Maker and the White Fiction Maker: The Variant Perceptual Cognitions	S. K. SAREEN	JASAL	SI	1	1996-01-01	144-151	publisher	type	reviewed_work	https://openjournals.library.sydney.edu.au/index.php/JASAL/article/view/9481data/JASAL3/96/SCHWARZ	doi	Between Two Deaths: The Love Poetry of Gwen Harwood	Susan SCHWARZ	JASAL	SI	1	1996-01-01	103-109	publisher	type	reviewed_work	https://openjournals.library.sydney.edu.au/index.php/JASAL/article/view/9476data/JASAL3/97/SLOGGETT	doi	'Delirious Monologues': Christina Stead's 'Egotistical Monsters'	Maria SLOGGETT	JASAL	SI	1	1996-01-01	121-128	publisher	type	reviewed_work	https://openjournals.library.sydney.edu.au/index.php/JASAL/article/view/9478data/JASAL3/98/DALZIELL	doi	Beyond the Verandah: Elizabeth Jolley's<U+00A0>The Orchard Thieves<U+00A0>and Drusilla Modjeska's<U+00A0>The Orchard	DALZIELL	JASAL	SI	1	1996-01-01	50-56	publisher	type	reviewed_work	https://openjournals.library.sydney.edu.au/index.php/JASAL/article/view/9470data/JASAL3/99/TYAS	doi	Sounding Out History: Landscape and Exploration in Recent Australian Fiction	Gillain TYAS	JASAL	SI	1	1996-01-01	159-163	publisher	type	reviewed_work	https://openjournals.library.sydney.edu.au/index.php/JASAL/article/view/9483data/JASAL3/100/WEBB	doi	Aussie Rules: Writing and Social Practice in a Regional Community	Jen WEBB	JASAL	SI	1	1996-01-01	243-251	publisher	type	reviewed_work	https://openjournals.library.sydney.edu.au/index.php/JASAL/article/view/9494data/JASAL3/101/WEST	doi	The Ethical Vision of Gerald Murnane	Patrick WEST	JASAL	SI	1	1996-01-01	221-227	publisher	type	reviewed_work	https://openjournals.library.sydney.edu.au/index.php/JASAL/article/view/9491data/JASAL3/102/ATTARD	doi	Nomadology in Kylie Tennant's<U+00A0>The Battlers	Karen ATTARD	JASAL	SI	1	1997-01-01	94-98	publisher	type	reviewed_work	https://openjournals.library.sydney.edu.au/index.php/JASAL/article/view/9513data/JASAL3/103/BOWERS	doi	Dwelling Within: Identity and Home in Contemporary Australian Autobiography	Tim BOWERS	JASAL	SI	1	1997-01-01	216-219	publisher	type	reviewed_work	https://openjournals.library.sydney.edu.au/index.php/JASAL/article/view/9534data/JASAL3/104/BRUNET	doi	Rewriting the Landscape: Judith Wright's Fragile Land and Haunted Self	Sandra BRUNET	JASAL	SI	1	1997-01-01	64-69	publisher	type	reviewed_work	https://openjournals.library.sydney.edu.au/index.php/JASAL/article/view/9508data/JASAL3/105/BULLEN	doi	Gendered Spaces: The Frontier in Rod Jones's<U+00A0>Billy Sunday	Elizabeth BULLEN	JASAL	SI	1	1997-01-01	70-75	publisher	type	reviewed_work	https://openjournals.library.sydney.edu.au/index.php/JASAL/article/view/9509data/JASAL3/106/BYRNE	doi	The Road to Babi Yar: Anti-historicism in Recent Australian Fiction	Trevor BYRNE	JASAL	SI	1	1997-01-01	209-215	publisher	type	reviewed_work	https://openjournals.library.sydney.edu.au/index.php/JASAL/article/view/9533data/JASAL3/107/CARSON	doi	Conversations with the Land: Environmental Questions and Eleanor Dark	Susan CARSON	JASAL	SI	1	1997-01-01	191-196	publisher	type	reviewed_work	https://openjournals.library.sydney.edu.au/index.php/JASAL/article/view/9530data/JASAL3/108/CLUNIES-ROSS	doi	Music, Poetry and the Natural Environment	Bruce CLUNIES-ROSS	JASAL	SI	1	1997-01-01	185-190	publisher	type	reviewed_work	https://openjournals.library.sydney.edu.au/index.php/JASAL/article/view/9529data/JASAL3/109/COLLETT	doi	'In a season without languages': Translative Process in the Poetry of Ouyang Yu, Vasso Kalamaras, Ania Walwicz and Antigone Kefala	Anne COLLETT	JASAL	SI	1	1997-01-01	232-238	publisher	type	reviewed_work	https://openjournals.library.sydney.edu.au/index.php/JASAL/article/view/9537